Bus Hound 6.00 capture on Windows Vista (x64). Complements of www.perisoft.net

  Device - Device ID (followed by the endpoint for USB devices)
            (6) AX99100 PCIe to High Speed Serial Port (COM2)
  Phase  - Phase Type
            IN    Data in transfer           
  Data   - Hex dump of the data transferred
  Descr  - Description of the phase
  Delta  - Elapsed time from the previous phase to the current phase
  Cmd... - Position in the captured data


Device  Phase  Data                                                Description       Delta  Cmd.Phase.Ofs(rep)
------  -----  --------------------------------------------------  ----------------  -----  ------------------
   6    IN     20 20 20 20  20                                                       2.8sc         1.1.0        
   6    IN     20 20 20 20  20 20 20 20  20 20                                       265ms         2.1.0        
   6    IN     20 20 20 20  20 20 20 20  20 20 20 20  20 20 20                        31ms         3.1.0        
   6    IN     0a 0d 0a                                            ...                15ms         4.1.0        
   6    IN     0d 0a 53 79  73 74 65 6d  20 73 74 61  72 74 75 70  ..System startup   15ms         5.1.0        
               0d 0a                                               ..                              5.1.16       
   6    IN     0d 0a 55 6e  63 6f 6d 70  72 65 73 73  20 4f 6b 21  ..Uncompress Ok!  203ms         6.1.0        
               0d 0a 0d 0a  55 2d 42 6f  6f 74 20 32  30 31 36 2e  ....U-Boot 2016.                6.1.16       
               31 31 20 28  4e 6f 76 20  31 37 20 32  30 32 31 20  11 (Nov 17 2021                 6.1.32       
               2d 20 31 37  3a 30 38 3a  34 30 20 2b  30 38 30 30  - 17:08:40 +0800                6.1.48       
               29 68 69 33  35 35 36 76  32 30 30 0d  0a 0d 0a 52  )hi3556v200....R                6.1.64       
               65 6c 6f 63  61 74 69 6f  6e 20 4f 66  66 73 65 74  elocation Offset                6.1.80       
               20 69 73 3a  20 30 66 36  64 37 30 30  30 0d 0a 52   is: 0f6d7000..R                6.1.96       
               65 6c 6f 63  61 74 69 6e  67 20 74 6f  20 38 66 65  elocating to 8fe                6.1.112      
               64 37 30 30  30 2c 20 6e  65 77 20 67  64 20 61 74  d7000, new gd at                6.1.128      
               20 38 66 65  39 36 65 66  30 2c 20 73  70 20 61 74   8fe96ef0, sp at                6.1.144      
               20 38 66 65  39 36 65 64  30 0d 0a                   8fe96ed0..                     6.1.160      
   6    IN     53 50 49 20  4e 6f 72 3a  20 20 42 6f  6f 74 20 4d  SPI Nor:  Boot M   31ms         7.1.0        
               65 64 69 61  20 69 73 6e  27 74 20 53  50 49 20 4e  edia isn't SPI N                7.1.16       
               6f 72 0d 0a  4e 41 4e 44  3a 20 20 43  68 65 63 6b  or..NAND:  Check                7.1.32       
               20 46 6c 61  73 68 20 4d  65 6d 6f 72  79 20 43 6f   Flash Memory Co                7.1.48       
               6e 74 72 6f  6c 6c 65 72  20 76 31 30  30 20 2e 2e  ntroller v100 ..                7.1.64       
               2e 20 46 6f  75 6e 64 0d  0a 53 50 49  20 4e 61 6e  . Found..SPI Nan                7.1.80       
               64 20 49 44  20 54 61 62  6c 65 20 56  65 72 73 69  d ID Table Versi                7.1.96       
               6f 6e 20 32  2e 37 0d 0a  53 50 49 20  4e 61 6e 64  on 2.7..SPI Nand                7.1.112      
               28 63 73 20  30 29 20 49  44 3a 20 30  78 32 63 20  (cs 0) ID: 0x2c                 7.1.128      
               30 78 32 34  20 4e 61 6d  65 3a 22 4d  54 32 39 46  0x24 Name:"MT29F                7.1.144      
               32 47 30 31  41 42 41 22  0d 0a 42 6c  6f 63 6b 3a  2G01ABA"..Block:                7.1.160      
               31 32 38 4b  42 20 50 61  67 65 3a 32  4b 42 20 4f  128KB Page:2KB O                7.1.176      
               4f 42 3a 31  32 38 42 20  45 43 43 3a  32 34 62 69  OB:128B ECC:24bi                7.1.192      
               74 2f 31 4b  20 0d 0a 43  68 69 70 73  69 7a 65 3a  t/1K ..Chipsize:                7.1.208      
               32 35 36 20  4d 69 42 0d  0a 4d 4d 43  3a 20 20 20  256 MiB..MMC:                   7.1.224      
               0d 0a 49 6e  3a 20 20 20  20 73 65 72  69 61 6c 0d  ..In:    serial.                7.1.240      
               0a 4f 75 74  3a 20                                  .Out:                           7.1.256      
   6    IN     20 20 73 65  72 69 61 6c  0d 0a 45 72  72 3a 20 20    serial..Err:     15ms         8.1.0        
               20 73 65 72  69 61 6c 0d  0a 4e 65 74  3a 20 20 20   serial..Net:                   8.1.16       
               65 74 68 30  0d 0a 57 61  72 6e 69 6e  67 3a 20 65  eth0..Warning: e                8.1.32       
               74 68 30 20  28 65 74 68  30 29 20 75  73 69 6e 67  th0 (eth0) using                8.1.48       
               20 72 61 6e  64 6f 6d 20  4d 41 43 20  61 64 64 72   random MAC addr                8.1.64       
               65 73 73 20  2d 20 65 65  3a 61 61 3a  38 35 3a 63  ess - ee:aa:85:c                8.1.80       
               61 3a 65 61  3a 66 32 0d  0a 0d 0a 48  69 74 20 61  a:ea:f2....Hit a                8.1.96       
               6e 79 20 6b  65 79 20 74  6f 20 73 74  6f 70 20 61  ny key to stop a                8.1.112      
               75 74 6f 62  6f                                     utobo                           8.1.128      
   6    IN     6f 74 3a 20  20 30 20 0d  0a 24 47 4d  2c 42 4f 4f  ot:  0 ..$GM,BOO   15ms         9.1.0        
               54 2c 53 54  41 54 55 53  2c 52 45 53  45 54 20 43  T,STATUS,RESET C                9.1.16       
               4d 4f 53 0d  0d 0a 24 47  4d 2c 42 4f  4f 54 2c 53  MOS...$GM,BOOT,S                9.1.32       
               54 41 54 55  53 2c 53 45  4e 44 2c 41  4c 49 56 45  TATUS,SEND,ALIVE                9.1.48       
               0d 0d 0a 0d  0a 4e 41 4e  44 20 72 65  61 64 3a 20  .....NAND read:                 9.1.64       
               64 65 76 69  63 65 20 30  20 6f 66 66  73 65 74 20  device 0 offset                 9.1.80       
               30 78 31 30  30 30 30 30  2c 20 73 69  7a 65 20 30  0x100000, size 0                9.1.96       
               78 31 30 30  30 30 0d 0a  20 36 35 35  33 36 20 62  x10000.. 65536 b                9.1.112      
               79 74 65 73  20 72 65 61  64 3a 20 4f  4b 0d 0a 0d  ytes read: OK...                9.1.128      
               0a 4e 41 4e  44 20 72 65  61 64 3a 20  64 65 76 69  .NAND read: devi                9.1.144      
               63 65 20 30  20 6f 66 66  73 65 74 20  30 78 32 30  ce 0 offset 0x20                9.1.160      
               30 30 30 30  2c 20 73 69  7a 65 20 30  78 31 30 30  0000, size 0x100                9.1.176      
               30 30 0d 0a  20                                     00..                            9.1.192      
   6    IN     36 35 35 33  36 20 62 79  74 65 73 20  72 65 61 64  65536 bytes read   15ms        10.1.0        
               3a 20 4f 4b  0d 0a 0d 0a  4e 41 4e 44  20 72 65 61  : OK....NAND rea               10.1.16       
               64 3a 20 64  65 76 69 63  65 20 30 20  6f 66 66 73  d: device 0 offs               10.1.32       
               65 74 20 30  78 31 30 30  30 30 30 2c  20 73 69 7a  et 0x100000, siz               10.1.48       
               65 20 30 78  31 30 30 30  30 0d 0a 20  36 35 35 33  e 0x10000.. 6553               10.1.64       
               36 20 62 79  74 65 73 20  72 65 61 64  3a 20 4f 4b  6 bytes read: OK               10.1.80       
               0d 0a 0d 0a  4e 41 4e 44  20 72 65 61  64 3a 20 64  ....NAND read: d               10.1.96       
               65 76 69 63  65 20 30 20  6f 66 66 73  65 74 20 30  evice 0 offset 0               10.1.112      
               78 32 30 30  30 30 30 2c  20 73 69 7a  65 20 30 78  x200000, size 0x               10.1.128      
               31 30 30 30  30 0d 0a 20  36 35 35 33  36 20 62 79  10000.. 65536 by               10.1.144      
               74 65 73 20  72 65 61 64  3a 20 4f 4b  0d 0a 44 42  tes read: OK..DB               10.1.160      
               47 3a 20 3c  43 79 63 6c  65 5f 47 65  74 5f 49 6e  G: <Cycle_Get_In               10.1.176      
               69 74 44 61  74 61                                  itData                         10.1.192      
   6    IN     3a 31 30 38  3e 20 43 6f  6d 70 72 65  73 73 5b 31  :108> Compress[1   15ms        11.1.0        
               5d 0d 0a 44  42 47 3a 20  3c 43 79 63  6c 65 5f 47  ]..DBG: <Cycle_G               11.1.16       
               65 74 5f 49  6e 69 74 44  61 74 61 3a  31 30 39 3e  et_InitData:109>               11.1.32       
               20 70 73 74  48 65 61 64  2d 3e 75 33  32 4d 61 67   pstHead->u32Mag               11.1.48       
               69 63 48 65  61 64 3a 20  30 78 36 33  37 39 36 33  icHead: 0x637963               11.1.64       
               36 63 20 2c  75 6c 53 72  63 20 30 78  38 32 31 30  6c ,ulSrc 0x8210               11.1.80       
               30 30 30 30  0d 0a 44 42  47 3a 20 3c  43 79 63 6c  0000..DBG: <Cycl               11.1.96       
               65 5f 47 65  74 5f 49 6e  69 74 44 61  74 61 3a 31  e_Get_InitData:1               11.1.112      
               31 30 3e 20  53 72 63 4c  65 6e 5b 36  35 35 33 36  10> SrcLen[65536               11.1.128      
               5d 20 43 79  63 6c 65 46  6c 61 73 68  53 69 7a 65  ] CycleFlashSize               11.1.144      
               5b 36 35 35  33 36 5d 0d  0a 44 42 47  3a 20 3c 43  [65536]..DBG: <C               11.1.160      
               79 63 6c 65  5f 47 65 74  5f 44 61 74  61 3a 32 30  ycle_Get_Data:20               11.1.176      
               37 3e 20 64  65 63                                  7> dec                         11.1.192      
   6    IN     6f 6d 70 72  65 73 73 20  6f 6b 21 0d  0a 0d 0a 4e  ompress ok!....N   16ms        12.1.0        
               41 4e 44 20  72 65 61 64  3a 20 64 65  76 69 63 65  AND read: device               12.1.16       
               20 30 20 6f  66 66 73 65  74 20 30 78  33 30 30 30   0 offset 0x3000               12.1.32       
               30 30 2c 20  73 69 7a 65  20 30 78 38  30 30 30 30  00, size 0x80000               12.1.48       
               30 0d 0a                                            0..                            12.1.64       
   6    IN     20 38 33 38  38 36 30 38  20 62 79 74  65 73 20 72   8388608 bytes r  359ms        13.1.0        
               65 61 64 3a  20 4f 4b 0d  0a 23 23 20  53 74 61 72  ead: OK..## Star               13.1.16       
               74 69 6e 67  20 63 70 75  31 20 41 37  20 61 74 20  ting cpu1 A7 at                13.1.32       
               30 78 38 37  32 30 30 30  30 30 20 2e  2e 2e 0d 0a  0x87200000 .....               13.1.48       
               0d 0a 4e 41  4e 44 20 72  65 61 64 3a  20 64 65 76  ..NAND read: dev               13.1.64       
               69 63 65 20  30 20 6f 66  66 73 65 74  20 30 78 62  ice 0 offset 0xb               13.1.80       
               30 30 30 30  30 2c 20 73  69 7a 65 20  30 78 35 30  00000, size 0x50               13.1.96       
               30 30 30 30  0d 0a                                  0000..                         13.1.112      
   6    IN     20 35 32 34  32 38 38 30  20 62 79 74  65 73 20 72   5242880 bytes r  218ms        14.1.0        
               65 61 64 3a  20 4f 4b 0d  0a 23 23 20  42 6f 6f 74  ead: OK..## Boot               14.1.16       
               69 6e 67 20  6b 65 72 6e  65 6c 20 66  72 6f 6d 20  ing kernel from                14.1.32       
               4c 65 67 61  63 79 20 49  6d 61 67 65  20 61 74 20  Legacy Image at                14.1.48       
               38 32 30 30  30 30 30 30  20 2e 2e 2e  0d 0a 20 20  82000000 .....                 14.1.64       
               20 49 6d 61  67 65 20 4e  61 6d 65 3a  20 20 20 4c   Image Name:   L               14.1.80       
               69 6e 75 78  2d 34 2e 39  2e 33 37 0d  0a 20 20 20  inux-4.9.37..                  14.1.96       
               49 6d 61 67  65 20 54 79  70 65 3a 20  20 20 41 52  Image Type:   AR               14.1.112      
               4d 20 4c 69  6e 75 78 20  4b 65 72 6e  65 6c 20 49  M Linux Kernel I               14.1.128      
               6d 61 67 65  20 28 75 6e  63 6f 6d 70  72 65 73 73  mage (uncompress               14.1.144      
               65 64 29 0d  0a 20 20 20  44 61 74 61  20 53 69 7a  ed)..   Data Siz               14.1.160      
               65 3a 20 20  20 20 31 39  36 35 34 30  36 20 42 79  e:    1965406 By               14.1.176      
               74 65 73 20  3d 20 31 2e  39 20 4d 69  42 0d 0a 20  tes = 1.9 MiB..                14.1.192      
               20 20 4c 6f  61 64 20 41  64 64 72 65  73 73 3a 20    Load Address:                14.1.208      
               38 30 30 30  38 30 30 30  0d 0a 20 20  20 45 6e 74  80008000..   Ent               14.1.224      
               72 79 20 50  6f 69 6e 74  3a 20 20 38  30 30 30 38  ry Point:  80008               14.1.240      
               30 30 30 0d  0a 20                                  000..                          14.1.256      
   6    IN     20 20 4c 6f  61 64 69 6e  67 20 4b 65  72 6e 65 6c    Loading Kernel   15ms        15.1.0        
               20 49 6d 61  67 65 20 2e  2e 2e 20 4f  4b 0d 0a 0d   Image ... OK...               15.1.16       
               0a 53 74 61  72 74 69 6e  67 20 6b 65  72 6e 65 6c  .Starting kernel               15.1.32       
               20 2e 2e 2e  0d 0a 0d 0a                             .......                       15.1.48       
   6    IN     68 75 62 20  32 2d 30 3a  31 2e 30 3a  20 63 6f 6e  hub 2-0:1.0: con  451ms        16.1.0        
               66 69 67 20  66 61 69 6c  65 64 2c 20  68 75 62 20  fig failed, hub                16.1.16       
               64 6f 65 73  6e 27 74 20  68 61 76 65  20 61 6e 79  doesn't have any               16.1.32       
               20 70 6f 72  74 73 21 20  28 65 72 72  20 2d 31 39   ports! (err -19               16.1.48       
               29 0d 0a                                            )..                            16.1.64       
   6    IN     6d 6b 6e 6f  64 3a 20 2f  64 65 76 2f  63 6f 6e 73  mknod: /dev/cons  328ms        17.1.0        
               6f 6c 65 3a  20 46 69 6c  65 20 65 78  69 73 74 73  ole: File exists               17.1.16       
               0d 0a 6d 6b  6e 6f 64 3a  20 2f 64 65  76 2f 74 74  ..mknod: /dev/tt               17.1.32       
               79 41 4d 41  30 3a 20 46  69 6c 65 20  65 78 69 73  yAMA0: File exis               17.1.48       
               74 73 0d 0a  6d 6b 6e 6f  64 3a 20 2f  64 65 76 2f  ts..mknod: /dev/               17.1.64       
               74 74 79 41  4d 41 31 3a  20 46 69 6c  65 20 65 78  ttyAMA1: File ex               17.1.80       
               69 73 74 73  0d 0a 6d 6b  6e 6f 64 3a  20 2f 64 65  ists..mknod: /de               17.1.96       
               76 2f 74 74  79 53 30 30  30 3a 20 46  69 6c 65 20  v/ttyS000: File                17.1.112      
               65 78 69 73  74 73 0d 0a  6d 6b 6e 6f  64 3a 20 2f  exists..mknod: /               17.1.128      
               64 65 76 2f  6e 75 6c 6c  3a 20 46 69  6c 65 20 65  dev/null: File e               17.1.144      
               78 69 73 74  73 0d 0a                               xists..                        17.1.160      
   6    IN     1b 5b 31 3b  33 33 6d 24  47 4d 2c 42  4f 4f 54 2c  .[1;33m$GM,BOOT,  522ms        18.1.0        
               49 4e 49 54  2c 57 41 49  54 2c 53 48  41 52 45 46  INIT,WAIT,SHAREF               18.1.16       
               73 0d 0a 1b  5b 6d                                  s...[m                         18.1.32       
   6    IN     1b 5b 31 3b  33 33 6d 24  47 4d 2c 42  4f 4f 54 2c  .[1;33m$GM,BOOT,  234ms        19.1.0        
               49 4e 49 54  2c 55 49 0d  0a 1b 5b 6d  1b 5b 31 3b  INIT,UI...[m.[1;               19.1.16       
               33 33 6d 24  47 4d 2c 42  4f 4f 54 2c  49 4e 49 54  33m$GM,BOOT,INIT               19.1.32       
               2c 55 49 2c  50 44 54 5f  55 49 5f 4c  6f 61 64 48  ,UI,PDT_UI_LoadH               19.1.48       
               69 46 42 0d  0a 1b 5b 6d  1b 5b 31 3b  33 33 6d 24  iFB...[m.[1;33m$               19.1.64       
               47 4d 2c 42  4f 4f 54 2c  49 4e 49 54  2c 55 49 2c  GM,BOOT,INIT,UI,               19.1.80       
               50 44 54 5f  55 49 5f 49  6e 69 74 48  69 67 76 0d  PDT_UI_InitHigv.               19.1.96       
               0a 1b 5b 6d                                         ..[m                           19.1.112      
   6    IN     1b 5b 31 3b  33 33 6d 24  47 4d 2c 42  4f 4f 54 2c  .[1;33m$GM,BOOT,  115ms        20.1.0        
               49 4e 49 54  2c 55 49 2c  50 44 54 5f  55 49 5f 53  INIT,UI,PDT_UI_S               20.1.16       
               74 61 72 74  4c 43 44 0d  0a 1b 5b 6d               tartLCD...[m                   20.1.32       
   6    IN     1b 5b 31 3b  33 33 6d 50  44 54 5f 55  49 5f 48 4f  .[1;33mPDT_UI_HO  124ms        21.1.0        
               4d 45 5f 4f  6e 53 68 6f  77 0d 0a 1b  5b 6d 1b 5b  ME_OnShow...[m.[               21.1.16       
               31 3b 33 33  6d 24 47 4d  2c 42 4f 4f  54 2c 49 4e  1;33m$GM,BOOT,IN               21.1.32       
               49 54 2c 55  49 2c 50 44  54 5f 55 49  5f 43 4f 4d  IT,UI,PDT_UI_COM               21.1.48       
               4d 5f 53 75  62 73 63 72  69 62 65 45  76 65 6e 74  M_SubscribeEvent               21.1.64       
               73 0d 0a 1b  5b 6d 5b 31  38 3a 31 36  3a 34 38 3a  s...[m[18:16:48:               21.1.80       
               36 34 32 5b  45 56 54 48  55 42 5d 20  73 75 62 73  642[EVTHUB] subs               21.1.96       
               63 72 69 62  65 20 65 72  72 6f 72 20  72 65 74 75  cribe error retu               21.1.112      
               72 6e 20 30  78 61 31 33  32 38 30 34  36 0d 0a 5b  rn 0xa1328046..[               21.1.128      
               31 38 3a 31  36 3a 34 38  3a 36 34 33  5b 45 56 54  18:16:48:643[EVT               21.1.144      
               48 55 42 5d  20 73 75 62  73 63 72 69  62 65 20 65  HUB] subscribe e               21.1.160      
               72 72 6f 72  20 72 65 74  75 72 6e 20  30 78 61 31  rror return 0xa1               21.1.176      
               33 32 38 30  34 36 0d 0a  5b 31 38 3a  31 36 3a 34  328046..[18:16:4               21.1.192      
               38 3a 36 34  33 5b 45 56  54 48 55 42  5d 20 73 75  8:643[EVTHUB] su               21.1.208      
               62 73 63 72  69 62 65 20  65 72 72 6f  72 20 72 65  bscribe error re               21.1.224      
               74 75 72 6e  20 30 78 61  31 33 32 38  30 34 36 0d  turn 0xa1328046.               21.1.240      
               0a 5b 31 38  3a 31 36                               .[18:16                        21.1.256      
   6    IN     3a 34 38 3a  36 34 33 5b  45 56 54 48  55 42 5d 20  :48:643[EVTHUB]    15ms        22.1.0        
               73 75 62 73  63 72 69 62  65 20 65 72  72 6f 72 20  subscribe error                22.1.16       
               72 65 74 75  72 6e 20 30  78 61 31 33  32 38 30 34  return 0xa132804               22.1.32       
               36 0d 0a 5b  31 38 3a 31  36 3a 34 38  3a 36 34 33  6..[18:16:48:643               22.1.48       
               5b 45 56 54  48 55 42 5d  20 73 75 62  73 63 72 69  [EVTHUB] subscri               22.1.64       
               62 65 20 65  72 72 6f 72  20 72 65 74  75 72 6e 20  be error return                22.1.80       
               30 78 61 31  33 32 38 30  34 36 0d 0a  1b 5b 31 3b  0xa1328046...[1;               22.1.96       
               33 33 6d 24  47 4d 2c 42  4f 4f 54 2c  49 4e 49 54  33m$GM,BOOT,INIT               22.1.112      
               2c 55 49 2c  50                                     ,UI,P                          22.1.128      
   6    IN     44 54 5f 55  49 5f 50 4f  57 45 52 43  54 52 4c 5f  DT_UI_POWERCTRL_   15ms        23.1.0        
               49 6e 69 74  0d 0a 1b 5b  6d 1b 5b 31  3b 33 33 6d  Init...[m.[1;33m               23.1.16       
               24 47 4d 2c  42 4f 4f 54  2c 49 4e 49  54 2c 55 49  $GM,BOOT,INIT,UI               23.1.32       
               2c 43 41 4e  2c 31 0d 0a  1b 5b 6d 1b  5b 31 3b 33  ,CAN,1...[m.[1;3               23.1.48       
               33 6d 24 47  4d 2c 42 4f  4f 54 2c 49  4e 49 54 2c  3m$GM,BOOT,INIT,               23.1.64       
               55 49 2c 56  4f 49 43 45  0d 0d 0a 1b  5b 6d 1b 5b  UI,VOICE....[m.[               23.1.80       
               31 3b 33 33  6d 24 47 4d  2c 42 4f 4f  54 2c 49 4e  1;33m$GM,BOOT,IN               23.1.96       
               49 54 2c 55  49 2c 48 49  5f 56 4f 49  43 45 50 4c  IT,UI,HI_VOICEPL               23.1.112      
               41 59 5f 53  65 74 4c 61  6e 67 2c 31  0d 0d 0a 1b  AY_SetLang,1....               23.1.128      
               5b 6d 1b 5b  31 3b 33 33  6d 24 47 4d  2c 42 4f 4f  [m.[1;33m$GM,BOO               23.1.144      
               54 2c 49 4e  49 54 2c 50  44 54 5f 41  48 44 4d 4e  T,INIT,PDT_AHDMN               23.1.160      
               47 5f 49 6e  69 74 0d 0a  1b 5b 6d 1b  5b 31 3b 33  G_Init...[m.[1;3               23.1.176      
               33 6d 24 47  4d 2c                                  3m$GM,                         23.1.192      
   6    IN     42 4f 4f 54  2c 49 4e 49  54 2c 53 43  45 4e 45 0d  BOOT,INIT,SCENE.   15ms        24.1.0        
               0a 1b 5b 6d  1b 5b 31 3b  33 33 6d 24  47 4d 2c 42  ..[m.[1;33m$GM,B               24.1.16       
               4f 4f 54 2c  49 4e 49 54  2c 53 54 41  54 4d 4e 47  OOT,INIT,STATMNG               24.1.32       
               0d 0a 1b 5b  6d 1b 5b 31  3b 33 33 6d  24 47 4d 2c  ...[m.[1;33m$GM,               24.1.48       
               42 4f 4f 54  2c 49 4e 49  54 2c 53 54  41 54 45 4d  BOOT,INIT,STATEM               24.1.64       
               4e 47 0d 0a  1b 5b 6d 1b  5b 31 3b 33  33 6d 24 47  NG...[m.[1;33m$G               24.1.80       
               4d 2c 42 4f  4f 54 2c 49  4e 49 54 2c  50 44 54 5f  M,BOOT,INIT,PDT_               24.1.96       
               53 54 41 54  45 4d 4e 47  5f 43 6f 6e  74 65 78 74  STATEMNG_Context               24.1.112      
               49 6e 69 74  0d 0a 1b 5b  6d 1b 5b 31  3b 33 33 6d  Init...[m.[1;33m               24.1.128      
               24 47 4d 2c  42 4f 4f 54  2c 49 4e 49  54 2c 50 44  $GM,BOOT,INIT,PD               24.1.144      
               54 5f 53 54  41 54 45 4d  4e 47 5f 43  72 65 61 74  T_STATEMNG_Creat               24.1.160      
               65 48 46 53  4d 49 6e 73  74 61 6e 63  65 0d 0a 1b  eHFSMInstance...               24.1.176      
               5b 6d 1b 5b  31 3b                                  [m.[1;                         24.1.192      
   6    IN     33 33 6d 24  47 4d 2c 42  4f 4f 54 2c  49 4e 49 54  33m$GM,BOOT,INIT   15ms        25.1.0        
               2c 50 44 54  5f 53 54 41  54 45 4d 4e  47 5f 49 6e  ,PDT_STATEMNG_In               25.1.16       
               69 74 53 74  61 74 65 73  0d 0a 1b 5b  6d 1b 5b 31  itStates...[m.[1               25.1.32       
               3b 33 33 6d  24 47 4d 2c  42 4f 4f 54  2c 49 4e 49  ;33m$GM,BOOT,INI               25.1.48       
               54 2c 50 44  54 5f 53 54  41 54 45 4d  4e 47 5f 53  T,PDT_STATEMNG_S               25.1.64       
               75 62 73 63  72 69 62 65  45 76 65 6e  74 73 0d 0a  ubscribeEvents..               25.1.80       
               1b 5b 6d 1b  5b 31 3b 33  33 6d 24 47  4d 2c 42 4f  .[m.[1;33m$GM,BO               25.1.96       
               4f 54 2c 49  4e 49 54 2c  48 49 5f 53  59 53 54 45  OT,INIT,HI_SYSTE               25.1.112      
               4d 5f 47 65  74                                     M_Get                          25.1.128      
   6    IN     53 74 61 72  74 75 70 57  61 6b 65 75  70 53 6f 75  StartupWakeupSou   15ms        26.1.0        
               72 63 65 0d  0a 1b 5b 6d  1b 5b 31 3b  33 33 6d 24  rce...[m.[1;33m$               26.1.16       
               47 4d 2c 42  4f 4f 54 2c  49 4e 49 54  2c 48 49 5f  GM,BOOT,INIT,HI_               26.1.32       
               50 44 54 5f  50 41 52 41  4d 5f 47 65  74 43 6f 6d  PDT_PARAM_GetCom               26.1.48       
               6d 50 61 72  61 6d 0d 0a  1b 5b 6d 1b  5b 31 3b 33  mParam...[m.[1;3               26.1.64       
               33 6d 24 47  4d 2c 42 4f  4f 54 2c 49  4e 49 54 2c  3m$GM,BOOT,INIT,               26.1.80       
               50 44 54 5f  53 54 41 54  45 4d 4e 47  5f 41 63 74  PDT_STATEMNG_Act               26.1.96       
               69 76 61 74  65 48 46 53  4d 0d 0a 1b  5b 6d 1b 5b  ivateHFSM...[m.[               26.1.112      
               31 3b 33 33  6d 24 47 4d  2c 42 4f 4f  54 2c 49 4e  1;33m$GM,BOOT,IN               26.1.128      
               49 54 2c 50  44 54 5f 53  54 41 54 45  4d 4e 47 5f  IT,PDT_STATEMNG_               26.1.144      
               50 6f 77 65  72 6f 6e 50  72 6f 63 0d  0a 1b 5b 6d  PoweronProc...[m               26.1.160      
               1b 5b 31 3b  33 33 6d 24  47 4d 2c 42  4f 4f 54 2c  .[1;33m$GM,BOOT,               26.1.176      
               49 4e 49 54  2c                                     INIT,                          26.1.192      
   6    IN     4c 4f 41 44  44 52 49 56  45 52 0d 0a  1b 5b 6d 1b  LOADDRIVER...[m.   15ms        27.1.0        
               5b 31 3b 33  33 6d 24 47  4d 2c 42 4f  4f 54 2c 49  [1;33m$GM,BOOT,I               27.1.16       
               4e 49 54 2c  4d 43 44 52  49 56 45 52  0d 0a 1b 5b  NIT,MCDRIVER...[               27.1.32       
               6d                                                  m                              27.1.48       
   6    IN     68 69 62 76  74 2d 69 32  63 20 31 32  30 62 33 30  hibvt-i2c 120b30   31ms        28.1.0        
               30 30 2e 69  32 63 3a 20  77 61 69 74  20 69 64 6c  00.i2c: wait idl               28.1.16       
               65 20 61 62  6f 72 74 21  2c 20 52 49  53 3a 20 30  e abort!, RIS: 0               28.1.32       
               78 36 31 31  0d 0a 68 69  62 76 74 2d  69 32 63 20  x611..hibvt-i2c                28.1.48       
               31 32 30 62  33 30 30 30  2e 69 32 63  3a 20 77 61  120b3000.i2c: wa               28.1.64       
               69 74 20 69  64 6c 65 20  61 62 6f 72  74 21 2c 20  it idle abort!,                28.1.80       
               52 49 53 3a  20 30 78 36  31 31 0d 0a  68 69 62 76  RIS: 0x611..hibv               28.1.96       
               74 2d 69 32  63 20 31 32  30 62 33 30  30 30 2e 69  t-i2c 120b3000.i               28.1.112      
               32 63 3a 20  77 61 69 74  20 69 64 6c  65 20 61 62  2c: wait idle ab               28.1.128      
               6f 72 74 21  2c 20 52 49  53 3a 20 30  78 36 31 31  ort!, RIS: 0x611               28.1.144      
               0d 0a 68 69  62 76 74 2d  69 32 63 20  31 32 30 62  ..hibvt-i2c 120b               28.1.160      
               33 30 30 30  2e 69 32 63  3a 20 77 61  69 74 20 69  3000.i2c: wait i               28.1.176      
               64 6c 65 20  61 62 6f 72  74 21 2c 20  52 49 53 3a  dle abort!, RIS:               28.1.192      
               20 30 78 36  31 31 0d 0a  68 69 62 76  74 2d 69 32   0x611..hibvt-i2               28.1.208      
               63 20 31 32  30 62 33 30  30 30 2e 69  32 63 3a 20  c 120b3000.i2c:                28.1.224      
               77 61 69 74  20 69 64 6c  65 20 61 62  6f 72 74 21  wait idle abort!               28.1.240      
               2c 20 52 49  53 3a                                  , RIS:                         28.1.256      
   6    IN     20 30 78 36  31 31 0d 0a  68 69 62 76  74 2d 69 32   0x611..hibvt-i2   15ms        29.1.0        
               63 20 31 32  30 62 33 30  30 30 2e 69  32 63 3a 20  c 120b3000.i2c:                29.1.16       
               77 61 69 74  20 69 64 6c  65 20 61 62  6f 72 74 21  wait idle abort!               29.1.32       
               2c 20 52 49  53 3a 20 30  78 36 31 31  0d 0a 68 69  , RIS: 0x611..hi               29.1.48       
               62 76 74 2d  69 32 63 20  31 32 30 62  33 30 30 30  bvt-i2c 120b3000               29.1.64       
               2e 69 32 63  3a 20 77 61  69 74 20 69  64 6c 65 20  .i2c: wait idle                29.1.80       
               61 62 6f 72  74 21 2c 20  52 49 53 3a  20 30 78 36  abort!, RIS: 0x6               29.1.96       
               31 31 0d 0a                                         11..                           29.1.112      
   6    IN     5b 31 38 3a  31 36 3a 34  38 3a 39 35  35 5b 45 56  [18:16:48:955[EV  171ms        30.1.0        
               54 48 55 42  5d 20 67 65  74 45 76 65  6e 74 48 69  THUB] getEventHi               30.1.16       
               73 74 6f 72  79 20 65 72  72 6f 72 20  72 65 74 75  story error retu               30.1.32       
               72 6e 20 30  78 61 31 33  32 38 30 34  37 0d 0a 0d  rn 0xa1328047...               30.1.48       
               0a                                                  .                              30.1.64       
   6    IN     1b 5b 31 3b  33 32 6d 57  65 6c 63 6f  6d 65 20 74  .[1;32mWelcome t   31ms        31.1.0        
               6f 20 1b 5b  31 3b 33 33  6d 47 6f 6c  64 65 6e 1b  o .[1;33mGolden.               31.1.16       
               5b 31 3b 33  31 6d 4d 61  72 74 69 61  6e 1b 5b 31  [1;31mMartian.[1               31.1.32       
               3b 33 32 6d  20 73 65 72  69 65 6c 1b  5b 30 3b 33  ;32m seriel.[0;3               31.1.48       
               39 6d 0d 0a  2f 20 23 20  68 69 62 76  74 2d 69 32  9m../ # hibvt-i2               31.1.64       
               63 20 31 32  30 62 33 30  30 30 2e 69  32 63 3a 20  c 120b3000.i2c:                31.1.80       
               77 61 69 74  20 69 64 6c  65 20 61 62  6f 72 74 21  wait idle abort!               31.1.96       
               2c 20 52 49  53 3a 20 30  78 36 31 31  0d 0a 68 69  , RIS: 0x611..hi               31.1.112      
               62 76 74 2d  69 32 63 20  31 32 30                  bvt-i2c 120                    31.1.128      
   6    IN     62 33 30 30  30 2e 69 32  63 3a 20 77  61 69 74 20  b3000.i2c: wait    15ms        32.1.0        
               69 64 6c 65  20 61 62 6f  72 74 21 2c  20 52 49 53  idle abort!, RIS               32.1.16       
               3a 20 30 78  36 31 31 0d  0a 68 69 62  76 74 2d 69  : 0x611..hibvt-i               32.1.32       
               32 63 20 31  32 30 62 33  30 30 30 2e  69 32 63 3a  2c 120b3000.i2c:               32.1.48       
               20 77 61 69  74 20 69 64  6c 65 20 61  62 6f 72 74   wait idle abort               32.1.64       
               21 2c 20 52  49 53 3a 20  30 78 36 31  31 0d 0a 68  !, RIS: 0x611..h               32.1.80       
               69 62 76 74  2d 69 32 63  20 31 32 30  62 33 30 30  ibvt-i2c 120b300               32.1.96       
               30 2e 69 32  63 3a 20 77  61 69 74 20  69 64 6c 65  0.i2c: wait idle               32.1.112      
               20 61 62 6f                                          abo                           32.1.128      
   6    IN     72 74 21 2c  20 52 49 53  3a 20 30 78  36 31 31 0d  rt!, RIS: 0x611.   15ms        33.1.0        
               0a 68 69 62  76 74 2d 69  32 63 20 31  32 30 62 33  .hibvt-i2c 120b3               33.1.16       
               30 30 30 2e  69 32 63 3a  20 77 61 69  74 20 69 64  000.i2c: wait id               33.1.32       
               6c 65 20 61  62 6f 72 74  21 2c 20 52  49 53 3a 20  le abort!, RIS:                33.1.48       
               30 78 36 31  31 0d 0a 68  69 62 76 74  2d 69 32 63  0x611..hibvt-i2c               33.1.64       
               20 31 32 30  62 33 30 30  30 2e 69 32  63 3a 20 77   120b3000.i2c: w               33.1.80       
               61 69 74 20  69 64 6c 65  20 61 62 6f  72 74 21 2c  ait idle abort!,               33.1.96       
               20 52 49 53  3a 20 30 78  36 31 31 0d  0a            RIS: 0x611..                  33.1.112      
   6    IN     1b 5b 31 3b  33 33 6d 24  47 4d 2c 42  4f 4f 54 2c  .[1;33m$GM,BOOT,  1.0sc        34.1.0        
               49 4e 49 54  2c 47 45 54  53 54 4f 52  41 47 45 43  INIT,GETSTORAGEC               34.1.16       
               46 47 0d 0a  1b 5b 6d 1b  5b 31 3b 33  33 6d 24 47  FG...[m.[1;33m$G               34.1.32       
               4d 2c 42 4f  4f 54 2c 49  4e 49 54 2c  53 54 4f 52  M,BOOT,INIT,STOR               34.1.48       
               41 47 45 4d  4e 47 5f 43  52 45 41 54  45 0d 0a 1b  AGEMNG_CREATE...               34.1.64       
               5b 6d                                               [m                             34.1.80       
   6    IN     5b 46 53 54  4f 4f 4c 5d  5b 57 41 52  4e 5d 20 46  [FSTOOL][WARN] F  187ms        35.1.0        
               69 6c 65 20  73 79 73 74  65 6d 20 69  73 20 63 6c  ile system is cl               35.1.16       
               65 61 6e 20  21 0d 0a                               ean !..                        35.1.32       
   6    IN     5b 46 53 54  4f 4f 4c 5d  5b 57 41 52  4e 5d 20 66  [FSTOOL][WARN] f   62ms        36.1.0        
               61 74 20 63  68 65 63 6b  20 69 6e 66  6f 20 69 6e  at check info in               36.1.16       
               76 61 6c 69  64 20 63 6c  75 73 74 65  72 20 63 6e  valid cluster cn               36.1.32       
               74 3a 30 2c  20 20 63 69  72 63 6c 65  20 63 6c 75  t:0,  circle clu               36.1.48       
               73 74 65 72  20 63 6e 74  20 3a 30 2c  20 63 72 6f  ster cnt :0, cro               36.1.64       
               73 73 20 63  6c 75 73 74  65 72 20 63  6e 74 20 3a  ss cluster cnt :               36.1.80       
               30 20 2e 0d  0a 5b 46 53  54 4f 4f 4c  5d 5b 57 41  0 ...[FSTOOL][WA               36.1.96       
               52 4e 5d 20  74 6f 74 61  6c 20 66 69  6c 65 20 63  RN] total file c               36.1.112      
               6e 74 3a 31  30                                     nt:10                          36.1.128      
   6    IN     37 2c 20 66  69 6c 65 20  73 65 67 6d  65 6e 74 20  7, file segment    15ms        37.1.0        
               63 6e 74 3a  30 2c 20 66  72 65 65 20  73 65 67 6d  cnt:0, free segm               37.1.16       
               65 6e 74 20  63 6e 74 3a  33 2c 20 76  6c 75 3a 30  ent cnt:3, vlu:0               37.1.32       
               2e 30 32 37  37 37 38 0d  0a                        .027778..                      37.1.48       
   6    IN     1b 5b 31 3b  33 33 6d 24  47 4d 2c 53  44 2c 4d 4f  .[1;33m$GM,SD,MO   31ms        38.1.0        
               55 4e 54 2c  43 48 45 43  4b 2c 55 50  47 52 41 44  UNT,CHECK,UPGRAD               38.1.16       
               45 0d 0a 1b  5b 6d 1b 5b  31 3b 33 33  6d 24 47 4d  E...[m.[1;33m$GM               38.1.32       
               2c 53 44 2c  4d 4f 55 4e  54 2c 49 4e  49 54 2c 46  ,SD,MOUNT,INIT,F               38.1.48       
               49 4c 45 4d  4e 47 0d 0a  1b 5b 6d                  ILEMNG...[m                    38.1.64       
   6    IN     1b 5b 31 3b  33 33 6d 24  47 4d 2c 53  44 2c 4d 4f  .[1;33m$GM,SD,MO   65ms        39.1.0        
               55 4e 54 2c  53 45 54 2c  53 54 41 54  55 53 0d 0a  UNT,SET,STATUS..               39.1.16       
               1b 5b 6d                                            .[m                            39.1.32       
   6    IN     1b 5b 31 3b  33 33 6d 24  47 4d 2c 46  41 43 54 4f  .[1;33m$GM,FACTO  237ms        40.1.0(2)     
               52 59 2c 32  2e 30 2e 33  2e 31 36 32  2e 32 30 32  RY,2.0.3.162.202               40.1.16       
               31 31 31 31  37 2c 2c 30  2c 2d 31 2c  30 30 30 2c  11117,,0,-1,000,               40.1.32       
               30 2c 30 2c  31 2c 36 2c  31 2c 30 2c  30 2c 30 2c  0,0,1,6,1,0,0,0,               40.1.48       
               32 2c 33 32  2c 2c 2c 2c  2c 0d 0d 0a  1b 5b 6d     2,32,,,,,....[m                40.1.64       
   6    IN     24 47 4d 2c  44 45 56 2c  47 53 45 4e  53 4f 52 2c  $GM,DEV,GSENSOR,  2.4sc        42.1.0        
               52 45 41 44  59 0d 0d 0a  5b 31 38 3a  31 36 3a 35  READY...[18:16:5               42.1.16       
               33 3a 31 31  39 5b 45 58  49 46 5d 20  68 61 76 65  3:119[EXIF] have               42.1.32       
               20 61 6c 72  65 61 64 79  20 69 6e 69  74 20 62 65   already init be               42.1.48       
               66 6f 72 65  2c 20 72 65  66 20 63 6e  74 3a 32 20  fore, ref cnt:2                42.1.64       
               0d 0a                                               ..                             42.1.80       
   6    IN     24 47 4d 2c  44 45 56 2c  47 50 53 2c  52 45 41 44  $GM,DEV,GPS,READ  281ms        43.1.0        
               59 0d 0d 0a                                         Y...                           43.1.16       
   6    IN     1b 5b 31 3b  33 33 6d 24  47 4d 2c 49  4e 49 54 2c  .[1;33m$GM,INIT,  737ms        44.1.0        
               43 41 4e 2c  54 48 52 45  41 44 2c 53  45 4e 44 2c  CAN,THREAD,SEND,               44.1.16       
               4b 45 45 50  41 4c 49 56  45 0d 0d 0a  1b 5b 6d     KEEPALIVE....[m                44.1.32       
   6    IN     1b 5b 31 3b  33 33 6d 24  47 4d 2c 43  41 4e 2c 48  .[1;33m$GM,CAN,H  171ms        45.1.0        
               49 5f 45 56  45 4e 54 5f  43 41 4e 5f  52 45 43 49  I_EVENT_CAN_RECI               45.1.16       
               56 45 52 5f  41 43 4b 2c  34 62 0d 0d  0a 0d 0d 0a  VER_ACK,4b......               45.1.32       
               1b 5b 6d                                            .[m                            45.1.48       
   6    IN     1b 5b 31 3b  33 33 6d 24  47 4d 2c 43  41 4e 2c 48  .[1;33m$GM,CAN,H   81ms        46.1.0        
               49 5f 45 56  45 4e 54 5f  43 41 4e 5f  52 45 43 49  I_EVENT_CAN_RECI               46.1.16       
               56 45 52 5f  54 59 50 45  56 45 52 53  49 4f 4e 2c  VER_TYPEVERSION,               46.1.32       
               30 2c 31 0d  0d 0a 1b 5b  6d 1b 5b 31  3b 33 33 6d  0,1....[m.[1;33m               46.1.48       
               24 47 4d 2c  43 41 4e 2c  56 45 52 53  49 4f 4e 2c  $GM,CAN,VERSION,               46.1.64       
               31 2e 30 2e  39 2e 37 2c  31 0d 0d 0a  1b 5b 6d 1b  1.0.9.7,1....[m.               46.1.80       
               5b 31 3b 33  33 6d 24 47  4d 2c 43 41  4e 2c 53 45  [1;33m$GM,CAN,SE               46.1.96       
               54 2c 57 41  54 43 48 44  4f 47 2c 4f  4e 0d 0d 0a  T,WATCHDOG,ON...               46.1.112      
               1b 5b 6d                                            .[m                            46.1.128      
   6    IN     1b 5b 31 3b  33 33 6d 24  47 4d 2c 46  41 43 54 4f  .[1;33m$GM,FACTO  265ms        47.1.0        
               52 59 2c 32  2e 30 2e 33  2e 31 36 32  2e 32 30 32  RY,2.0.3.162.202               47.1.16       
               31 31 31 31  37 2c 31 2e  30 2e 39 2e  37 2c 31 2c  11117,1.0.9.7,1,               47.1.32       
               30 2c 30 38  31 2c 31 2c  30 2c 31 2c  36 2c 31 2c  0,081,1,0,1,6,1,               47.1.48       
               30 2c 30 2c  30 2c 32 2c  33 32 2c 2c  2c 2c 2c 0d  0,0,0,2,32,,,,,.               47.1.64       
               0d 0a 1b 5b  6d                                     ...[m                          47.1.80       
   6    IN     1b 5b 31 3b  33 33 6d 24  47 4d 2c 46  41 43 54 4f  .[1;33m$GM,FACTO  1.9sc        48.1.0        
               52 59 2c 32  2e 30 2e 33  2e 31 36 32  2e 32 30 32  RY,2.0.3.162.202               48.1.16       
               31 31 31 31  37 2c 31 2e  30 2e 39 2e  37 2c 31 2c  11117,1.0.9.7,1,               48.1.32       
               30 2c 30 30  38 2c 31 2c  30 2c 31 2c  36 2c 31 2c  0,008,1,0,1,6,1,               48.1.48       
               30 2c 30 2c  30 2c 32 2c  33 32 2c 2c  2c 2c 2c 0d  0,0,0,2,32,,,,,.               48.1.64       
               0d 0a 1b 5b  6d                                     ...[m                          48.1.80       
   6    IN     1b 5b 31 3b  33 33 6d 24  47 4d 2c 46  41 43 54 4f  .[1;33m$GM,FACTO  999ms        49.1.0        
               52 59 2c 53  44 2c 52 45  41 44 59 2c  53 48 4f 57  RY,SD,READY,SHOW               49.1.16       
               2c 54 45 53  54 2c 2c 2c  2c 2c 0d 0d  0a 1b 5b 6d  ,TEST,,,,,....[m               49.1.32       
   6    IN     1b 5b 31 3b  33 33 6d 24  47 4d 2c 46  41 43 54 4f  .[1;33m$GM,FACTO  1.0sc        50.1.0        
               52 59 2c 32  2e 30 2e 33  2e 31 36 32  2e 32 30 32  RY,2.0.3.162.202               50.1.16       
               31 31 31 31  37 2c 31 2e  30 2e 39 2e  37 2c 31 2c  11117,1.0.9.7,1,               50.1.32       
               30 2c 30 33  30 2c 31 2c  30 2c 31 2c  36 2c 31 2c  0,030,1,0,1,6,1,               50.1.48       
               30 2c 30 2c  30 2c 32 2c  33 32 2c 2c  2c 2c 2c 0d  0,0,0,2,32,,,,,.               50.1.64       
               0d 0a 1b 5b  6d                                     ...[m                          50.1.80       
